### ISSUE TITLE
Intel E810-XXV netcard can not boot with ipxe

### ISSUE THREAD

**Issue by Xu-Wentao** [ipxe/ipxe#498]

**Comment by MansM** [comment]
any luck with this @NiKiZe ?

**Comment by stappersg** [comment]
Mention original poster @Xu-Wentao 
![afbeelding](https://user-images.githubusercontent.com/35434094/162739791-95be2085-5218-4140-91f4-9b48248ab306.png)

**Comment by NiKiZe** [comment]
Closing due to lack of info

**Comment by stappersg** [comment]
Suggestion:
Place here the case number of Intel's Tech Support.

**Comment by dwarnich** [comment]
Running into similar problem. Updated E810 firmware to v22.0.9, A00 (from Dell), no luck. Compiled using latest source off Github at time of publishing.

ifstat shows:
![image](https://github.com/ipxe/ipxe/assets/102608532/1a97e17c-1714-4296-8bec-b366ca9ca5fe)

**Comment by NiKiZe** [comment]
> Running into similar problem. Updated E810 firmware to v22.0.9, A00 (from Dell), no luck. Compiled using latest source off Github at time of publishing.
> 
> ifstat shows: ![image](https://user-images.githubusercontent.com/102608532/250606132-1a97e17c-1714-4296-8bec-b366ca9ca5fe.png)

You are also using the pcbios and undionly driver. So any issues is with the undi driver in nic or BIOS ROM.

With that said, you have sucessfull both TX and RX, so what is the issue you are getting? Does dhcp config fail? Or something else?

**Comment by dwarnich** [comment]
Using pcbios and undionly chainloading to ipxe yes. 

DHCP config in ipxe fails.
![image](https://github.com/ipxe/ipxe/assets/102608532/48a82920-6317-47d5-badd-bdd230ebc06a)

But checking config shows IP received from PXE.
![image](https://github.com/ipxe/ipxe/assets/102608532/cd24ea5f-c9a6-4909-b726-256f29d62500)

 Ping shows the following:
![image](https://github.com/ipxe/ipxe/assets/102608532/e530ff8b-dfee-41a1-a9ac-12b3b97aed4c)

**Comment by NiKiZe** [comment]
If you can, please try and figure out where it breaks, does the dhcp or ICMP requests reach the destination? (Trying to figure out if it is TX path or RX path that has issues)

Also verify if there is any VLAN or similar issues involved.
Does this work in EFI mode?

**Comment by dwarnich** [comment]
Tested in EFI mode, also does not work.
![image](https://github.com/ipxe/ipxe/assets/102608532/33421818-9527-40fc-8485-d39969339596)
tcpdump on DHCP server shows no DHCP packets received during EFI boot. 

Chainloading with BIOS boot shows sent packets but no received packets.
![image](https://github.com/ipxe/ipxe/assets/102608532/987b45e1-51fe-4d9a-80da-6b176ccf9e3e)
Tcpdump on DHCP server shows request and response
`10:37:55.920952 IP 0.0.0.0.bootpc > 255.255.255.255.bootps: BOOTP/DHCP, Request from b4:96:91:ec:be:a8, length 400
10:37:55.921228 IP 10.1.0.1.bootps > 255.255.255.255.bootpc: BOOTP/DHCP, Reply, length 303
10:37:57.953209 IP 0.0.0.0.bootpc > 255.255.255.255.bootps: BOOTP/DHCP, Request from b4:96:91:ec:be:a8, length 400
10:37:57.953541 IP 10.1.0.1.bootps > 255.255.255.255.bootpc: BOOTP/DHCP, Reply, length 303
10:38:02.017703 IP 0.0.0.0.bootpc > 255.255.255.255.bootps: BOOTP/DHCP, Request from b4:96:91:ec:be:a8, length 400
10:38:02.018062 IP 10.1.0.1.bootps > 255.255.255.255.bootpc: BOOTP/DHCP, Reply, length 303`

PS. I have various other hosts booting successfully from the same DHCP server

**Comment by dwarnich** [comment]
Woot, works using ipxe.pxe (previously had undionly.kpxe).

**Comment by NiKiZe** [comment]
> Tested in EFI mode, also does not work. ![image](https://user-images.githubusercontent.com/102608532/250864902-33421818-9527-40fc-8485-d39969339596.png) tcpdump on DHCP server shows no DHCP packets received during EFI boot.
> 

This shows your firmware trying to net-boot, before iPXE even could be started. This is clearly something to report to the manufacturer of the hardware.

> Chainloading with BIOS boot shows sent packets but no received packets. ![image](https://user-images.githubusercontent.com/102608532/250876716-987b45e1-51fe-4d9a-80da-6b176ccf9e3e.png) Tcpdump on DHCP server shows request and response `10:37:55.920952 IP 0.0.0.0.bootpc > 255.255.255.255.bootps: BOOTP/DHCP, Request from b4:96:91:ec:be:a8, length 400 10:37:55.921228 IP 10.1.0.1.bootps > 255.255.255.255.bootpc: BOOTP/DHCP, Reply, length 303 10:37:57.953209 IP 0.0.0.0.bootpc > 255.255.255.255.bootps: BOOTP/DHCP, Request from b4:96:91:ec:be:a8, length 400 10:37:57.953541 IP 10.1.0.1.bootps > 255.255.255.255.bootpc: BOOTP/DHCP, Reply, length 303 10:38:02.017703 IP 0.0.0.0.bootpc > 255.255.255.255.bootps: BOOTP/DHCP, Request from b4:96:91:ec:be:a8, length 400 10:38:02.018062 IP 10.1.0.1.bootps > 255.255.255.255.bootpc: BOOTP/DHCP, Reply, length 303`
> 
> PS. I have various other hosts booting successfully from the same DHCP server

Thanks for narrowing the issue down to receive path, at least in the pcbios case.

Yes iPXE does have native drivers for several NICs. I'm sorry for not recommending this earlier, the downside is that in pcbios if you nic isn't supported by native drivers, it won't boot at all since it can't fallback.

**Comment by dwarnich** [comment]
Thanks for your assistance Christian! Yes these E810s are trouble. Prefer the Broadcom 25GbE cards (particularly for DPDK) but it's a lottery what Dell sends one these days.
